{
  "schemaVersion": "aga-demo-workspace-authority-fixture/v1",
  "templateId": "aga-demo-authority-template-v1",
  "caaOrganizationId": "AGA-DEMO-CAA",
  "departmentId": "AGA-DEMO-DEPARTMENT",
  "organizationalUnitId": "AGA-DEMO-UNIT",
  "syntheticNamespace": "AGA_DEMO_ONLY",
  "roleSlots": [
    {"slot":"CAA_ADMIN","requiredRoles":["admin"],"projection":"CAA_FULL"},
    {"slot":"DEPARTMENT_MANAGER","requiredRoles":["manager"],"projection":"CLASSIFICATION_AND_LIFECYCLE_MANAGER"},
    {"slot":"INSPECTOR","requiredRoles":["inspector"],"projection":"ASSIGNED_INSPECTOR"},
    {"slot":"LEAD_INSPECTOR","requiredRoles":["lead_inspector"],"projection":"ASSIGNED_LEAD"},
    {"slot":"CAA_REVIEWER","requiredRoles":["lead_inspector"],"projection":"CAP_REVIEWER"},
    {"slot":"AUDITEE_MATCHING","requiredRoles":["auditee"],"projection":"MATCHING_ORGANIZATION"},
    {"slot":"AUDITEE_OTHER_ORGANIZATION","requiredRoles":["auditee"],"projection":"OTHER_ORGANIZATION"},
    {"slot":"CAA_UNRELATED","requiredRoles":["caa_reviewer"],"projection":"UNRELATED_CAA"},
    {"slot":"INSPECTOR_OTHER","requiredRoles":["inspector"],"projection":"OTHER_SCOPE"}
  ],
  "organizations": [
    {"organizationId":"AGA-DEMO-CAA","name":"Synthetic CAA","other":false},
    {"organizationId":"AGA-DEMO-OTHER-ORG","name":"Synthetic Other Organization","other":true}
  ],
  "providerConfiguration": [
    {"providerTypeCode":"AERODROME_OPERATOR","disposition":"INSPECTED_SCOPE_ELIGIBLE","reasonCode":"CANDIDATE_PROFILE_BOUNDARY"},
    {"providerTypeCode":"ANSP","disposition":"INVOLVEMENT_ONLY","reasonCode":"CANDIDATE_PROFILE_BOUNDARY"},
    {"providerTypeCode":"CNS_PROVIDER","disposition":"INVOLVEMENT_ONLY","reasonCode":"CANDIDATE_PROFILE_BOUNDARY"},
    {"providerTypeCode":"AIS_AIM_PROVIDER","disposition":"INVOLVEMENT_ONLY","reasonCode":"CANDIDATE_PROFILE_BOUNDARY"},
    {"providerTypeCode":"MET_PROVIDER","disposition":"INVOLVEMENT_ONLY","reasonCode":"CANDIDATE_PROFILE_BOUNDARY"},
    {"providerTypeCode":"SAR_ORGANIZATION","disposition":"INVOLVEMENT_ONLY","reasonCode":"CANDIDATE_PROFILE_BOUNDARY"},
    {"providerTypeCode":"AVSEC_PROVIDER","disposition":"INVOLVEMENT_ONLY","reasonCode":"CANDIDATE_PROFILE_BOUNDARY"},
    {"providerTypeCode":"AIR_OPERATOR","disposition":"INVOLVEMENT_ONLY","reasonCode":"CANDIDATE_PROFILE_BOUNDARY"},
    {"providerTypeCode":"AMO","disposition":"INVOLVEMENT_ONLY","reasonCode":"CANDIDATE_PROFILE_BOUNDARY"},
    {"providerTypeCode":"ATO","disposition":"INVOLVEMENT_ONLY","reasonCode":"CANDIDATE_PROFILE_BOUNDARY"},
    {"providerTypeCode":"GROUND_HANDLING","disposition":"INVOLVEMENT_ONLY","reasonCode":"CANDIDATE_PROFILE_BOUNDARY"},
    {"providerTypeCode":"FUEL_PROVIDER","disposition":"INVOLVEMENT_ONLY","reasonCode":"CANDIDATE_PROFILE_BOUNDARY"},
    {"providerTypeCode":"CARGO_REGULATED_AGENT","disposition":"INVOLVEMENT_ONLY","reasonCode":"CANDIDATE_PROFILE_BOUNDARY"},
    {"providerTypeCode":"RPAS_UAS_OPERATOR","disposition":"INVOLVEMENT_ONLY","reasonCode":"CANDIDATE_PROFILE_BOUNDARY"},
    {"providerTypeCode":"CAMO","disposition":"NO_DEFAULT_AGA_RELATIONSHIP","reasonCode":"NO_PROFILE_AUTHORITY"},
    {"providerTypeCode":"FSTD","disposition":"NO_DEFAULT_AGA_RELATIONSHIP","reasonCode":"NO_PROFILE_AUTHORITY"},
    {"providerTypeCode":"DOA","disposition":"NO_DEFAULT_AGA_RELATIONSHIP","reasonCode":"NO_PROFILE_AUTHORITY"},
    {"providerTypeCode":"POA","disposition":"NO_DEFAULT_AGA_RELATIONSHIP","reasonCode":"NO_PROFILE_AUTHORITY"},
    {"providerTypeCode":"AEMC","disposition":"NO_DEFAULT_AGA_RELATIONSHIP","reasonCode":"NO_PROFILE_AUTHORITY"},
    {"providerTypeCode":"AME","disposition":"NO_DEFAULT_AGA_RELATIONSHIP","reasonCode":"NO_PROFILE_AUTHORITY"}
  ],
  "scopes": [
    {"scopeSlot":"MATCHING_AERODROME_OPERATOR","organizationSlot":"MATCHING","providerTypeCode":"AERODROME_OPERATOR","providerScopeRootId":"aga-ws-scope-root-matching","providerScopeId":"aga-ws-scope-matching","providerScopeVersion":1,"targetId":"aga-ws-target-matching","canonicalTargetKind":"FACILITY","targetProfileCode":"RFFS_FUNCTION"},
    {"scopeSlot":"OTHER_AERODROME_OPERATOR","organizationSlot":"OTHER","providerTypeCode":"AERODROME_OPERATOR","providerScopeRootId":"aga-ws-scope-root-other","providerScopeId":"aga-ws-scope-other","providerScopeVersion":1,"targetId":"aga-ws-target-other","canonicalTargetKind":"FACILITY","targetProfileCode":"RFFS_FUNCTION"}
  ],
  "bindingRules": [
    {"bindingId":"template-caa_admin","subjectSlot":"CAA_ADMIN","membershipSlot":"CAA_ADMIN_MEMBERSHIP","organizationId":"AGA-DEMO-CAA","departmentId":"AGA-DEMO-DEPARTMENT","organizationalUnitId":"AGA-DEMO-UNIT","operationRoles":["admin"],"active":true},
    {"bindingId":"template-department_manager","subjectSlot":"DEPARTMENT_MANAGER","membershipSlot":"DEPARTMENT_MANAGER_MEMBERSHIP","organizationId":"AGA-DEMO-CAA","departmentId":"AGA-DEMO-DEPARTMENT","organizationalUnitId":"AGA-DEMO-UNIT","operationRoles":["manager"],"active":true},
    {"bindingId":"template-inspector","subjectSlot":"INSPECTOR","membershipSlot":"INSPECTOR_MEMBERSHIP","organizationId":"AGA-DEMO-CAA","departmentId":"AGA-DEMO-DEPARTMENT","organizationalUnitId":"AGA-DEMO-UNIT","operationRoles":["inspector"],"active":true},
    {"bindingId":"template-lead_inspector","subjectSlot":"LEAD_INSPECTOR","membershipSlot":"LEAD_INSPECTOR_MEMBERSHIP","organizationId":"AGA-DEMO-CAA","departmentId":"AGA-DEMO-DEPARTMENT","organizationalUnitId":"AGA-DEMO-UNIT","operationRoles":["lead_inspector"],"active":true},
    {"bindingId":"template-caa_reviewer","subjectSlot":"CAA_REVIEWER","membershipSlot":"CAA_REVIEWER_MEMBERSHIP","organizationId":"AGA-DEMO-CAA","departmentId":"AGA-DEMO-DEPARTMENT","organizationalUnitId":"AGA-DEMO-UNIT","operationRoles":["lead_inspector"],"active":true},
    {"bindingId":"template-auditee_matching","subjectSlot":"AUDITEE_MATCHING","membershipSlot":"AUDITEE_MATCHING_MEMBERSHIP","organizationId":"AGA-DEMO-CAA","departmentId":"AGA-DEMO-DEPARTMENT","organizationalUnitId":"AGA-DEMO-UNIT","operationRoles":["auditee"],"active":true},
    {"bindingId":"template-auditee_other_organization","subjectSlot":"AUDITEE_OTHER_ORGANIZATION","membershipSlot":"AUDITEE_OTHER_ORGANIZATION_MEMBERSHIP","organizationId":"AGA-DEMO-OTHER-ORG","departmentId":"AGA-DEMO-DEPARTMENT","organizationalUnitId":"AGA-DEMO-UNIT","operationRoles":["auditee"],"active":true},
    {"bindingId":"template-caa_unrelated","subjectSlot":"CAA_UNRELATED","membershipSlot":"CAA_UNRELATED_MEMBERSHIP","organizationId":"AGA-DEMO-CAA","departmentId":"AGA-DEMO-DEPARTMENT","organizationalUnitId":"AGA-DEMO-UNIT","operationRoles":["caa_reviewer"],"active":true},
    {"bindingId":"template-inspector_other","subjectSlot":"INSPECTOR_OTHER","membershipSlot":"INSPECTOR_OTHER_MEMBERSHIP","organizationId":"AGA-DEMO-CAA","departmentId":"AGA-DEMO-DEPARTMENT","organizationalUnitId":"AGA-DEMO-UNIT","operationRoles":["inspector"],"active":true}
  ]
}
